video_url,user_url,username,title,view_num,created_at,shortdesc,collected_at
/watch?v=aiEBEGKQp_I&pp=ygUNbWljcm9wbGFzdGljcw%3D%3D,/@UNEP,UN Environment Programme,How microplastics affect your health,130K,4 years,51 Trillion particles of microplastics float in our oceans. Yet there is very little science of how this affects our health. This video ...,2024-01-30 02:08:26.457878
/watch?v=_bNySyEobfY&pp=ygUNbWljcm9wbGFzdGljcw%3D%3D,/@Medcram,MedCram - Medical Lectures Explained CLEARLY,"Microplastics in Our Food and Body: Cutting Boards, Microwaves, More",76K,4 months,"(This video was recorded on September 17th, 2023) Roger Seheult, MD is the co-founder and lead professor at ...",2024-01-30 02:08:26.465571
/watch?v=7vSMcb9X3kU&pp=ygUNbWljcm9wbGFzdGljcw%3D%3D,/@cbs8sandiego,CBS 8 San Diego,Microplastics and their impact on the human body,16K,1 year,"Now we can use it to test more parts of the body, our tissue, our brain. Now we are able to definitely say that they stay in our body,” ...",2024-01-30 02:08:26.470549
/watch?v=vocvz6N6faI&pp=ygUNbWljcm9wbGFzdGljcw%3D%3D,/@GreshamCollege,Gresham College,"Microplastics, Public Health Myth or Menace - Ian Mudway",6.9K,4 months,Microplastics - tiny plastic particles less than 5mm long - were first identified in the ocean but are now known to be ubiquitous ...,2024-01-30 02:08:26.480666
/watch?v=jX2TNS8a1lQ&pp=ygUNbWljcm9wbGFzdGljcw%3D%3D,/@NASEM_Health,NASEM Health and Medicine Division,Session 3: Impact of Microplastics on Human Health,5.9K,2 years,DEVELOPMENT OF A Screening TOOL FOR NANO/MICROPLASTIC HUMAN HEALTH HAZARD STUDIES ...,2024-01-30 02:08:26.483147
/watch?v=1PlK9oGQvzA&pp=ygUNbWljcm9wbGFzdGljcw%3D%3D,/@DWDocumentary,DW Documentary,How dangerous are microplastics? | DW Documentary,132K,1 year,"Microplastics have only recently become an issue outside the scientific world. A pioneering researcher in this field, Christian ...",2024-01-30 02:08:26.487766
/watch?v=vi--wEwvYkA&pp=ygUNbWljcm9wbGFzdGljcw%3D%3D,/@PBSNewsHour,PBS NewsHour,Why you may be eating and drinking more microplastics than you thought,82K,2 weeks,"From takeout containers to water bottles, plastic seems unavoidable in our daily lives. Now, two new studies have found that we're ...",2024-01-30 02:08:26.492302
/watch?v=PNh-f7NpA-A&pp=ygUNbWljcm9wbGFzdGljcw%3D%3D,/@NatGeo,National Geographic,How to Cleanse Your Beauty Regime of Microplastic | National Geographic,25K,5 years,"About National Geographic: National Geographic is the world's premium destination for science, exploration, and adventure.",2024-01-30 02:08:26.502325
/watch?v=v8u-zkXNdFQ&pp=ygUNbWljcm9wbGFzdGljcw%3D%3D,/@EFSA_EU,EFSAchannel,What are microplastics and nanoplastics?,2.7K,2 years,"Subtitles are available in English, French, German, Italian and Spanish. Click on the “turn on captions” button in the lower right ...",2024-01-30 02:08:33.943190
/watch?v=VyeV1f2sSwo&pp=ygUNbWljcm9wbGFzdGljcw%3D%3D,/@5news,5NEWS,New research shows new information about microplastics in water bottles,50K,2 weeks,Researchers at Columbia University found that on average a liter of water can have half a quarter of a million particles of plastics.,2024-01-30 02:08:33.945534
/watch?v=HPG73eyU-NE&pp=ygUNbWljcm9wbGFzdGljcw%3D%3D,/@globeandmail,The Globe and Mail,Searching for microplastics within the human body,27K,3 years,"Plastic debris is everywhere in nature, and the harm it causes is impossible to ignore. But it's less clear what ingesting plastics is ...",2024-01-30 02:08:33.948015
/watch?v=tjhzI_Pc2jk&pp=ygUNbWljcm9wbGFzdGljcw%3D%3D,/@SiimLand,Siim Land,"How to Detox Microplastics From Your Body (BPA, Metals, Pesticides, Xenoestrogens etc)",19K,1 year,Disclaimer I do not own any of the video clips used in this video. The legal rights belong to the legal copyright holders of said ...,2024-01-30 02:08:33.950582
/watch?v=nxEQkVPBJjQ&pp=ygUNbWljcm9wbGFzdGljcw%3D%3D,/@D2E,Down To Earth,Microplastics detected in human blood for the very first time,41K,1 year,"Microplastic pollution has been detected in human blood for the first time. The study, published in the journal Environment ...",2024-01-30 02:08:33.953058
/watch?v=ZHCgA-n5wRw&pp=ygUNbWljcm9wbGFzdGljcw%3D%3D,/@NatGeo,National Geographic,Are Microplastics in Our Water Becoming a Macroproblem? | National Geographic,215K,8 years,"You might not be able to see them, but they're in the water. Although trash heaps are easier to spot in waterways, ...",2024-01-30 02:08:33.956369
/watch?v=zVWHXg4TBaM&pp=ygUNbWljcm9wbGFzdGljcw%3D%3D,/@EFSA_EU,EFSAchannel,What are the effects of microplastics and nanoplastics on human health?,2.5K,2 years,"Subtitles are available in English, French, German, Italian and Spanish. Click on the “turn on captions” button in the lower right ...",2024-01-30 02:08:33.958815
/watch?v=CwX6YpocW7c&pp=ygUNbWljcm9wbGFzdGljcw%3D%3D,/@StirlingCooper,Stirling Cooper,How Microplastics Infest Your Body,8.2K,6 months,"Microplastics infest your body in the modern world. It is in our blood, our brain, and our lungs. Stirling Cooper presents research ...",2024-01-30 02:08:33.961486
/watch?v=O1B44VmZFiI&pp=ygUNbWljcm9wbGFzdGljcw%3D%3D,/@joerogan,PowerfulJRE,Dr. Shanna Swan on How Plastics in Food are Affecting Our Hormone Levels,1.2M,2 years,Taken from JRE #1638 w/Dr. Shanna Swan: ...,2024-01-30 02:08:33.963975
/watch?v=RS7IzU2VJIQ&pp=ygUNbWljcm9wbGFzdGljcw%3D%3D,/@kurzgesagt,Kurzgesagt – In a Nutshell,Plastic Pollution: How Humans are Turning the World into Plastic,9.3M,5 years,Modern life would be impossible without plastic – but we have long since lost control over our invention. Why has plastic turned ...,2024-01-30 02:08:33.967899
/shorts/Fc51lVjaseY,/@Oneminmicro,Walt (oneminmicro),Canned fish under microscope reveals MICROPLASTICS!,827K,5 months,Microplastic - is it going to be a public health emergency in the future? I'd love to know what you think! And if you'd like some extra ...,2024-01-30 02:08:33.970511
/watch?v=RvshJFZl5T0&pp=ygUNbWljcm9wbGFzdGljcw%3D%3D,/@10TampaBay,10 Tampa Bay,Researchers find microplastics in human blood for the first time,1.2K,1 year,Microplastics — the small pieces of plastic debris that have found their way into every aspect of our planet are now in our blood.,2024-01-30 02:08:33.973079
/shorts/FnCY8yLLZdg,/@doctorjanine,"Dr. Janine Bowring, ND",How to Remove Microplastics from Your Body #shorts,58K,6 months,How to Remove Microplastics from Your Body #shorts Dr. Janine shares how to remove microplastics from your body. She talks ...,2024-01-30 02:08:44.589221
/watch?v=BIvHrC_mS_M&pp=ygUNbWljcm9wbGFzdGljcw%3D%3D,/@aragusea,Adam Ragusea,Food Plastics = Estrogens in Your Body,518K,4 years,"It's true: Chemicals in common food plastics mimic estrogens in your body, potentially causing fertility problems in men, heart ...",2024-01-30 02:08:44.596941
/watch?v=w-heU3ydI_E&pp=ygUNbWljcm9wbGFzdGljcw%3D%3D,/@D2E,Down To Earth,Microplastics in your bottled water?,10K,5 years,Latest studies have claimed that the best brands of bottled water may be contaminated with microplastics. These are cancer ...,2024-01-30 02:08:44.600436
/watch?v=B_RBPAhx06w&pp=ygUNbWljcm9wbGFzdGljcw%3D%3D,/@toxicslink,Toxics Link,The Story of Microplastic,17K,2 years,"Microplastics are everywhere- in the air we breathe, the water we drink, the soil we grow vegetables. Oceans are full of these ...",2024-01-30 02:08:44.617923
/watch?v=c1buXEZlAS4&pp=ygUNbWljcm9wbGFzdGljcw%3D%3D,/@WION,WION,Microplastics in breast milk raise concerns over infant's health | International News | WION,41K,1 year,"In a shocking discovery, microplastics have been detected in breast milk for the first time. The presence of microplastics in breast ...",2024-01-30 02:08:44.620440
/watch?v=5Dd9hKfE6g4&pp=ygUNbWljcm9wbGFzdGljcw%3D%3D,/@LIMC,Lessons in Meme Culture,Why Is Everyone Eating Microplastics?,433K,1 year,I f*cking love microplastics Please comment if you know more about this meme's origins. Become a member to get access to ...,2024-01-30 02:08:44.622865
/watch?v=0rGT8SrKnY4&pp=ygUNbWljcm9wbGFzdGljcw%3D%3D,/@NutritionFactsOrg,NutritionFacts.org,Are Microplastics in Seafood a Cancer Risk?,23K,4 years,Plastic particles may exacerbate the pollutant contamination of fish. New subscribers to our e-newsletter always receive a free gift.,2024-01-30 02:08:44.628666
/watch?v=jjsrmFUmyh4&pp=ygUNbWljcm9wbGFzdGljcw%3D%3D,/@TEDx,TEDx Talks,Microplastics are everywhere | Sarah Dudas | TEDxBinghamtonUniversity,89K,5 years,"We live in a world of plastic. From the clothes we wear, the electronics we use to the food we buy, our lives our surrounded by, and ...",2024-01-30 02:08:44.632095
/watch?v=tG4AYagBz9Q&pp=ygUNbWljcm9wbGFzdGljcw%3D%3D,/@BehindtheNewsABC,Behind the News,What Are Microplastics And How Are They Harming Our Oceans? Plastic Pollution - Behind the News,54K,7 years,Tuesday the 22nd of March is World Water Day. So we're going to take a closer look at a threat to our oceans that you might not ...,2024-01-30 02:08:44.647023
/watch?v=KpyjNGv7pXY&pp=ygUNbWljcm9wbGFzdGljcw%3D%3D,/@thermofisher,Thermo Fisher Scientific,The inner plastic ocean: Monitoring microplastics in blood with the Attune CytPix,186,8 months,"Welcome to the 2023 Attune NxT User Meeting, where we bring you insights on the latest advances in flow cytometry technology ...",2024-01-30 02:08:44.649319
/watch?v=pai2OsNuqrs&pp=ygUNbWljcm9wbGFzdGljcw%3D%3D,/@ArirangCoKrArirangNEWS,Arirang News,S. Korean research discovers microplastics spread to all organs,805,2 years,"미세플라스틱, 빠른 시간에 체내 모든 기관에 퍼져 Microplastic debris in the world's oceans not only impacts marine life, but also ...",2024-01-30 02:08:44.659054
/shorts/TZH0Nw3Er5c,/@doctorjanine,"Dr. Janine Bowring, ND",6 Tips How To Detox Microplastics #shorts,4.5K,2 years,6 Tips How To Detox Microplastics #shorts #detox.,2024-01-30 02:08:44.678053
/watch?v=49OJoTsZYO0&pp=ygUNbWljcm9wbGFzdGljcw%3D%3D,/@explainitychannel,explainitychannel,Microplastics explained (explainity® explainer video),66K,4 years,Billions of tons of microplastics are floating in the oceans and spread across the land. You want to know where the small plastic ...,2024-01-30 02:08:44.681143
/shorts/HlZvfG6SXF0,/@doctorjanine,"Dr. Janine Bowring, ND",3 Reasons Microplastics are Harmful #shorts,7.9K,1 year,3 Reasons Microplastics are Harmful #shorts Dr. Janine shares three reasons microplastics are harmful. She talks about how ...,2024-01-30 02:08:44.692073
/shorts/GZmzFhjJAh8,/@attn,ATTN:,3 ways to avoid microplastics.,26K,1 year,shorts.,2024-01-30 02:08:44.700301
/shorts/YzsN9qoXQUs,/@AnkurShah,Ankur Shah,Microplastics are in Human Blood! #shorts,1.4K,1 year,Microplastics have now been found in human blood! Microplastics in our blood may transfer to organs and affect our health in ...,2024-01-30 02:08:44.709843
/watch?v=-m0YaE8uKcg&pp=ygUNbWljcm9wbGFzdGljcw%3D%3D,/@TEDEd,TED-Ed,The smallest solution to one of our biggest problems - Tierney Thys & Christian Sardet,414K,1 year,Explore the possibility of plastivores— organisms that can eat and break down plastic— helping reduce the plastic waste on Earth.,2024-01-30 02:08:44.712315
/watch?v=Eu9UoPttUfI&pp=ygUNbWljcm9wbGFzdGljcw%3D%3D,/@ScopeofScience,Kurtis Baute,You Eat Plastic Every Day. Here's How To Avoid It.,262K,4 years,"Microplastics are everywhere, including in your body. I spent 24 hours doing everything I could to avoid ingesting them.",2024-01-30 02:08:44.724031
/shorts/jLUR-wx65t8,/@doctorjanine,"Dr. Janine Bowring, ND",Microplastics in Tea Bags 🔥 #shorts,84K,1 year,Microplastics in Tea Bags #shorts Dr. Janine shares a great hack for avoiding microplastics from tea bags. She explains how tea ...,2024-01-30 02:08:44.729891
/watch?v=NgjMd-VNEac&pp=ygUNbWljcm9wbGFzdGljcw%3D%3D,/@neoscribe2295,NeoScribe,Disturbing Discovery Of Microplastics Inside Our Bodies,54K,5 years,"Hello, welcome to NeoScribe. There are many benefits to plastic. It's light, moldable, strong, and inexpensive. And it's the perfect ...",2024-01-30 02:08:44.739667
/watch?v=hWZR_a6Pq1M&pp=ygUNbWljcm9wbGFzdGljcw%3D%3D,/@anatomyandphysiologyvideo,New Anatomy and Physiology Video,Have Microplastics Entered the Human Body,863,1 year,"Microplastics have been found in various human body tissues and fluids, including in the blood, urine, and feces. Studies have ...",2024-01-30 02:08:55.532834
/watch?v=SgHUIqi5Bik&pp=ygUNbWljcm9wbGFzdGljcw%3D%3D,/@TRTWorldNow,TRT World Now,How do microplastics get into the air?,508,2 years,Janice Brahney from Utah State University discusses a warning from scientists that microplastics have become so pervasive that ...,2024-01-30 02:08:55.535577
/watch?v=uNt-qOuKOVU&pp=ygUNbWljcm9wbGFzdGljcw%3D%3D,/@nowthisearth,NowThis Earth,Plastics in Food: 5 Everyday Foods High in Microplastics,66K,2 years,#Plastic #Food #Earth #Environment #Science #NowThis Connect with NowThis » Subscribe to NowThis News: ...,2024-01-30 02:08:55.540527
/watch?v=PLrk53Sl4YQ&pp=ygUNbWljcm9wbGFzdGljcw%3D%3D,/@globalnews,Global News,New study reveals the dangers of inhaling microplastics,5.4K,7 months,A new study shows some detrimental effects of microplastics. Data suggests that the tiny plastic particles can be found in human ...,2024-01-30 02:08:55.547153
/watch?v=oM7ufCNmIy0&pp=ygUNbWljcm9wbGFzdGljcw%3D%3D,/@NSFScience,National Science Foundation News,Environmental Weathering of Microplastics,1.1K,1 year,plastic #waste #environment #microplastics The Effects of Environmental Weathering on Microplastics: Understanding the Threat ...,2024-01-30 02:08:55.549558
/watch?v=pdcsSnGYgUw&pp=ygUNbWljcm9wbGFzdGljcw%3D%3D,/@Gittemary,Gittemary Johansen,THE IMPACT OF MICROPLASTIC // and 8 ways to avoid it,15K,1 year,"SOURCES: • Tyson Brown, National Geographic Society, 2019, https://www.nationalgeographic.org/encyclopedia/microplastics/ ...",2024-01-30 02:08:55.553225
/watch?v=AJUOjBhJe1E&pp=ygUNbWljcm9wbGFzdGljcw%3D%3D,/@fionn294,Fionn Ferreira,The extraction of microplastics from water using ferro-fluids,577K,5 years,This is an accompanying video to my project: an investigation into the removal of microplastics from water using ferrofluids.,2024-01-30 02:08:55.557487
/watch?v=A59U5NnR8CQ&pp=ygUNbWljcm9wbGFzdGljcw%3D%3D,/@MictheVegan,Mic the Vegan,Viral TikTok Exposes Microplastics in McDonald's Nuggets,37K,1 year,#ChickenNuggets #Microplastics #TikTok.,2024-01-30 02:08:55.560428
/watch?v=fm5o_A5pEV0&pp=ygUNbWljcm9wbGFzdGljcw%3D%3D,/@TEDx,TEDx Talks,Microplastics: A local problem with a local solution | Jay Brandes | TEDxSavannah,3.7K,1 year,"Plastics – they're everywhere! When marine scientist Jay Brandes found microplastics in ocean samples from half a world away, ...",2024-01-30 02:08:55.563546
/watch?v=acMYHAmNLlE&pp=ygUNbWljcm9wbGFzdGljcw%3D%3D,/@DWDocumentary,DW Documentary,How to avoid microplastics in your food / UNSEEN (2/5) | DW Documentary,83K,2 years,"Food lover Nazrudin Rahman is shocked to hear that microplastics are in our food, water and air. Here's how the cooking show ...",2024-01-30 02:08:55.569999
/shorts/A9Qe2lC9XCE,/@MasteringDiabetes,Mastering Diabetes,😲 Microplastics Found in Human Blood for the First Time #shorts,13K,1 year,Microplastics Found in Human Blood for the First Time #shorts Watch and Enjoy! Cyrus & Robby Guaranteed Diabetes Coaching ...,2024-01-30 02:08:55.573136
/watch?v=r49fl59mFtU&pp=ygUNbWljcm9wbGFzdGljcw%3D%3D,/@VergeScience,Verge Science,How to find the microplastics in your seafood,516K,4 years,Tiny bits of plastic waste have found their way to the farthest corners of the planet — from the deepest ocean trenches to the Arctic ...,2024-01-30 02:08:55.576651
/watch?v=GhZ_XicFuyY&pp=ygUNbWljcm9wbGFzdGljcw%3D%3D,/@TEDx,TEDx Talks,"Microplastics:  Knowns, Unknowns, and Actions | Sheila Hemami | TEDxBeaconStreet",17K,4 years,"Plastic in the ocean is increasingly in the public eye, and often conjures thoughts of “The Great Pacific Garbage Patch.",2024-01-30 02:08:55.580389
/watch?v=iuOd4aGzHjQ&pp=ygUNbWljcm9wbGFzdGljcw%3D%3D,/@ACSMeetingNews,American Chemical Society Meeting Newsroom,"Cooking up a way to remove microplastics from wastewater — with okra, aloe",2.3K,1 year,"In many cuisines, okra serves as a master thickener of stews and soups. The goo from that fruit and other plants, such as aloe, ...",2024-01-30 02:08:55.584480
/watch?v=k9RYCuBIw9o&pp=ygUNbWljcm9wbGFzdGljcw%3D%3D,/@FormulaBotanicaSchool,Formula Botanica,EP115. The microplastics hiding in your cosmetics,924,1 year,"Reducing plastic in the packaging of personal care products is high on the agenda of many mainstream cosmetics' firms, but are ...",2024-01-30 02:08:55.588620
/watch?v=UfpAJPH4uTU&pp=ygUNbWljcm9wbGFzdGljcw%3D%3D,/@DrWholeness,Dr. Matt Angove,Microplastics in coffee cups | Endocrine Disruptors,1.1K,1 year,"What is that in your coffee cup? Coffee cup liners are a huge, overlooked contributor to microplastic accumulation in your body.",2024-01-30 02:08:55.591165
/shorts/6BUhbcGiYEY,/@ecomasteryproject8322,EcoMastery Project,A filter to catch microplastics in the water,9K,2 years,A filter to catch microplastics in the water Follow US! Blog https://www.ecomasteryproject.com/ Instagram ...,2024-01-30 02:08:55.592835
/watch?v=53yxfkeXLn0&pp=ygUNbWljcm9wbGFzdGljcw%3D%3D,/@interstatetechnologyandreg9859,Interstate Technology and Regulatory Council,Microplastics Policies & Research Around the Globe,230,9 months,"On March 22nd, 2023, the ITRC partnered with the Australasian Land & Groundwater Association (ALGA) and Network for ...",2024-01-30 02:08:55.594029
/watch?v=ZFgpudNSArI&pp=ygUNbWljcm9wbGFzdGljcw%3D%3D,/@Seeker,Seeker,Are You Seasoning Your Food With Microplastics? (You Totally Are),337K,5 years,"Plastic pollution has made its way from the ocean to your kitchen table. A recent study found salt grains now contain microplastics, ...",2024-01-30 02:08:55.595378
/watch?v=avZTsuvnc7U&pp=ygUNbWljcm9wbGFzdGljcw%3D%3D,/@4ISTC,Illinois Sustainable Technology Center,Assessing and Managing Risks of Microplastics in Ecosystems and Drinking Water,253,1 year,"Presented keynote on April 28, 2022, by Scott Coffin - Research Scientist, California State Water Resources Control Board - 2022 ...",2024-01-30 02:09:09.163424
/watch?v=30aJ2kWYAvM&pp=ygUNbWljcm9wbGFzdGljcw%3D%3D,/@commentiquette,Internet Comment Etiquette with Erik,You're Filled with Microplastics,512K,1 year,"In today's lesson, we learn that microplastics are yet one more thing to add to the neverending list of threats against our continued ...",2024-01-30 02:09:09.166689
/watch?v=BoYiFyzMHes&pp=ygUNbWljcm9wbGFzdGljcw%3D%3D,/@LangloisVitalNutritionCenter,Langlois' Vital Nutrition Center,Microplastics - How to Support Detoxification,1.1K,1 year,We improve your health naturally! Interested in our services? We are available for telehealth consultations! Give us a call: ...,2024-01-30 02:09:09.173313
/watch?v=zg0jH0avlYQ&pp=ygUNbWljcm9wbGFzdGljcw%3D%3D,/@TotalFitnessUSA,Catherine Carrigan,Wes Carter How Microplastics Affect Your Health and What You Can Do About It,116,9 days,"Medical intuitive healer Catherine Carrigan interviews Wes Carter, president of Atlantic Packaging and founder of A New Earth ...",2024-01-30 02:09:09.176320
/watch?v=PDbOGgWCM-E&pp=ygUNbWljcm9wbGFzdGljcw%3D%3D,/@ambercentre6761,AMBER Centre,High levels of microplastics released from infant-feeding bottles during formula preparation,960,3 years,New analysis presents evidence of global infant exposure to microplastics and the need for appropriate mitigation strategies and ...,2024-01-30 02:09:09.179936
/watch?v=R4MyifvlfbY&pp=ygUNbWljcm9wbGFzdGljcw%3D%3D,/@Seeker,Seeker,"You’re Breathing in Microplastics, But What Does That Mean for Your Health?",69K,2 years,"Microplastics are everywhere—in our food, water, and now even the air we breathe. But scientists are just starting to understand ...",2024-01-30 02:09:09.184084
/watch?v=fsjvwQclGLo&pp=ygUNbWljcm9wbGFzdGljcw%3D%3D,/@Vox,Vox,"Why 99% of ocean plastic pollution is ""missing""",5.3M,2 years,The plastic we dump into the ocean might be hiding in plain sight. Subscribe to our channel! http://goo.gl/0bsAjO Vox.com is a ...,2024-01-30 02:09:09.188259
/watch?v=-_2Ost0Sw3k&pp=ygUNbWljcm9wbGFzdGljcw%3D%3D,/@TEDx,TEDx Talks,Microplastics All Around Us  | Dr. Jesse Meiller | TEDxFoggyBottom,2.2K,1 year,"Doctor Jesse Meiller, serves as the Director of Undergraduate Studies in American University's Department of Environmental ...",2024-01-30 02:09:09.192181
/watch?v=44KE0M--IqI&pp=ygUNbWljcm9wbGFzdGljcw%3D%3D,/@Firstpost,Firstpost,Microplastics Could Enter Your Brain. Here's How | Vantage with Palki Sharma,25K,4 months,"Microplastics Could Enter Your Brain. Here's How | Vantage with Palki Sharma Microplastics are already in our lungs, hearts and ...",2024-01-30 02:09:09.198288
/watch?v=beUhzQAkanM&pp=ygUNbWljcm9wbGFzdGljcw%3D%3D,/@Vox,Vox,Why these plankton are eating plastic,1.3M,4 years,"Microfibers, used to make things like yoga pants, are the ocean's tiniest problem. This video is presented by Brilliant: ...",2024-01-30 02:09:09.207108
/watch?v=AF2DpLu-7BM&pp=ygUNbWljcm9wbGFzdGljcw%3D%3D,/@royalsocietyofchemistry4447,Royal Society Of Chemistry,Microplastics toxicologist,674,1 year,"Stephanie Wright leads the Microplastics Team at Imperial College London, focussing on the detection, characterisation, and ...",2024-01-30 02:09:09.213547
/watch?v=MW9BVhouwj4&pp=ygUNbWljcm9wbGFzdGljcw%3D%3D,/@surrealentertainment,surreal entertainment,a minion overdoses on microplastics and then proceeds to jump off a rooftop,443K,1 year,the story of a minion going against the grain (thanks to @Podel for the minion model inspiration) Discord: ...,2024-01-30 02:09:09.218875
/shorts/QlSLeJ8a-Ms,/@SciShow,SciShow,This is an egg-celent solution to microplastics. #shorts #science #SciShow,507K,10 months,Hosted by: Savannah Geary (they/them) Lucas Principe: Writer Sarah Mukherjee: Fact Checker Amy Peterson: Script Editor Faith ...,2024-01-30 02:09:09.222188
/watch?v=pPfDBbdyqSo&pp=ygUNbWljcm9wbGFzdGljcw%3D%3D,/@sustainabilitytheory5154,Sustainability Theory,Filtering Microplastics From Water With Egg Whites,284,1 year,Ian Cossland from Timcast IRL Twitter post areogel could filter out microplasticssalt/desalination 98-99% effectiveness Inventor ...,2024-01-30 02:09:09.228646
/watch?v=RGZQkkruxdo&pp=ygUNbWljcm9wbGFzdGljcw%3D%3D,/@WION,WION,Gravitas: The menace of microplastics,10K,5 months,Microplastics have been found in the hearts of human beings undergoing cardiac surgery. Molly Gambhir tells you more ...,2024-01-30 02:09:09.231902
/watch?v=HO6Hpf0kg9o&pp=ygUNbWljcm9wbGFzdGljcw%3D%3D,/@cheddar,Cheddar,How Much Plastic Is Really In Our Bodies? - Cheddar Explains,48K,1 year,"Plastic has become the face of global pollution. To date, humans have produced 8.3 billion metric tons of it. Once discarded ...",2024-01-30 02:09:09.237842
/watch?v=XwFXFxAFuJU&pp=ygUNbWljcm9wbGFzdGljcw%3D%3D,/@ecoayamedia,AYA,How Fast Fashion & (Recycled) Polyester Create The Microplastics In Our Blood,10K,1 year,"We are covered in petroleum. Hydrocarbons create the plastics (polyester, nylon, elastane, acrylic, etc) that seep into our ...",2024-01-30 02:09:09.241185
/watch?v=veMdowmPSbw&pp=ygUNbWljcm9wbGFzdGljcw%3D%3D,/@BBCEarthScience,BBC Earth Science,How Much Plastic Do You Eat? #OurBluePlanet | Earth Science,115K,6 years,"For more information on this fascinating science check out the following links from the University of Exeter: Plastics, plankton and ...",2024-01-30 02:09:09.249870
